{
  "$id": "esp.json/fields/struct.schema.json",
  "$schema": "http://json-schema.org/draft-07/schema#",
  "title": "Struct",
  "type": "object",
  "required": ["type", "elements"],
  "properties": {
    "type": {
      "constant": "struct"
    },
    "name": {
      "$ref": "../shared/name.schema.json"
    },
    "elements": {
      "type": "array",
      "items": {
        "$ref": "../field.schema.json"
      }
    },
    "sortKey": {
      "$ref": "../shared/sortKey.schema.json"
    }
  }
}
